{
  "$schema": "https://json-schema.org/draft/2020-12/schema",
  "$id": "https://github.com/Nananananana/kiseki/schemas/interest-export-v1.json",
  "title": "kiseki-interest-export v1",
  "description": "The only document KISEKI prepares for the world outside the machine: the corrected profile's interests with month-level time, and the lifecycle stages of those same topics. What is absent is the design (ADR-0047, ADR-0069).",
  "type": "object",
  "required": ["schema", "version", "exported_on", "interests", "stages"],
  "additionalProperties": false,
  "properties": {
    "schema": {
      "const": "kiseki-interest-export",
      "description": "The document names its contract. A consumer reads this first and refuses what it does not recognise."
    },
    "version": {
      "const": 1,
      "description": "Anything that does not fit this shape changes it by a visible version bump."
    },
    "exported_on": {
      "type": "string",
      "pattern": "^\\d{4}-\\d{2}-\\d{2}$",
      "description": "The day the export was made. A day, never a moment: an exact timestamp is a fact about the owner."
    },
    "interests": {
      "type": "array",
      "items": { "$ref": "#/$defs/interest" },
      "description": "Strongest first, by score times confidence. Empty is valid: a library with nothing to say says nothing."
    },
    "stages": {
      "type": "array",
      "items": { "$ref": "#/$defs/stage" },
      "description": "Lifecycle stages, only ever for topics the interests carried out with them."
    }
  },
  "$defs": {
    "interest": {
      "type": "object",
      "required": ["topic", "score", "confidence", "first_seen", "last_seen"],
      "additionalProperties": false,
      "description": "One interpretation. It carries its own confidence, because an interpretation with no confidence is an opinion wearing a fact's clothes.",
      "properties": {
        "topic": {
          "type": "string",
          "minLength": 1,
          "not": { "pattern": "^place:" },
          "description": "A place topic never leaves, named or not: a list of places is a movement history."
        },
        "score": {
          "type": "number",
          "minimum": 0,
          "maximum": 1,
          "description": "How strongly the evidence points at the topic."
        },
        "confidence": {
          "type": "number",
          "minimum": 0,
          "maximum": 1,
          "description": "How far the evidence can be trusted to support the reading at all. Required, always."
        },
        "first_seen": {
          "type": "string",
          "pattern": "^\\d{4}-\\d{2}$",
          "description": "The month the topic first appeared. Months only; a day would locate the owner in time."
        },
        "last_seen": {
          "type": "string",
          "pattern": "^\\d{4}-\\d{2}$",
          "description": "The month it last appeared. Not before first_seen -- a rule no schema can express, checked by the conformance kit."
        }
      }
    },
    "stage": {
      "type": "object",
      "required": ["topic", "stage"],
      "additionalProperties": false,
      "properties": {
        "topic": {
          "type": "string",
          "minLength": 1,
          "not": { "pattern": "^place:" }
        },
        "stage": {
          "enum": ["new", "returned", "growing", "declining", "dormant", "stable"]
        }
      }
    }
  }
}
