{
  "schema": "kiseki-interest-export",
  "version": 1,
  "exported_on": "2026-08-30",
  "interests": [
    { "topic": "ramen", "score": 0.82, "confidence": 0.7, "first_seen": "2024-11", "last_seen": "2026-08" },
    { "topic": "film photography", "score": 0.61, "confidence": 0.55, "first_seen": "2025-03", "last_seen": "2026-07" },
    { "topic": "raft", "score": 0.4, "confidence": 0.5, "first_seen": "2026-02", "last_seen": "2026-08" }
  ],
  "stages": [
    { "topic": "ramen", "stage": "stable" },
    { "topic": "raft", "stage": "new" }
  ]
}
